<?xml version="1.0" encoding="UTF-8"?>
<content xmlns:xsi="http://www.w3.org/2001/XMLSchema-instance"
    xsi:noNamespaceSchemaLocation="../xsd/template-content.xsd">
    <dataset>
    <name>application_dataset_name</name>
    </dataset>
    <dataset>
        <name>metadata</name>
    </dataset>
    <hierarchy>
    <title>DECOMM APPLICATION TITLE</title>
        
        <node>
      <id>parent_node_id</id>
      <label>PARENT NODE LABEL</label>
            <icon>allapplications16</icon>
            
            <node>
                <id>baseball</id>
                <label>Baseball</label>
                <icon>businessobject16</icon>
                <chainOfCustody>true</chainOfCustody>
                <contentViewSettings>
                    <contentViewSetting refid="playerDetails"/>
					<contentViewSetting refid="displayChainOfCustodyInfo"/>                    
                </contentViewSettings>
                <searchSettings>
                    <searchSetting name="Players" refid="searchPlayers"/>
                </searchSettings>
            </node>
            <node>
                <id>employee</id>
                <label>Employee Management</label>
                <icon>businessobject16</icon>
                <chainOfCustody>true</chainOfCustody>
                <contentViewSettings>
                    <contentViewSetting refid="employeeDetail"/>
                    <contentViewSetting refid="employeePayHistoryDetail"/>
                    <contentViewSetting refid="displayChainOfCustodyInfo"/>
                </contentViewSettings>
                <searchSettings>
                    <searchSetting name="Employee Search" refid="employeeSearch"/>
                    <searchSetting refid="employeePayrollDateSearch" name="Payroll Date Search"/>
                </searchSettings>
            </node>
            <node>
                <id>property</id>
                <label>Property Management</label>
                <icon>businessobject16</icon>
                <chainOfCustody>true</chainOfCustody>
                <contentViewSettings>
                    <contentViewSetting refid="propertyRentStreamDetail"/>
                    <contentViewSetting refid="propertyRentOptionsDetail"/>
                    <contentViewSetting refid="displayChainOfCustodyInfo"/>
                </contentViewSettings>
                <searchSettings>
                    <searchSetting name="Lease" refid="searchLeaseRentStream"/>
                    <searchSetting name="Options" refid="searchLeaseOptions"/>
                    <searchSetting name="Dynamic Columns" refid="searchLeaseDynamicColumns"/>
                </searchSettings>
            </node>
            <node>
                <id>reconciliation</id>
                <label>Reconciliation/Account Management</label>
                <icon>businessobject16</icon>
                <chainOfCustody>true</chainOfCustody>
                <contentViewSettings>
                    <contentViewSetting refid="generalLedgerDetails"/>
                    <contentViewSetting refid="subLedgerDetails"/>
                    <contentViewSetting refid="recDetails"/>
                    <contentViewSetting refid="historyDetails"/>
                    <contentViewSetting refid="accountDetails"/>
                    <contentViewSetting refid="displayChainOfCustodyInfo"/>
                </contentViewSettings>
                <searchSettings>
                    <searchSetting name="Reconciliation" refid="searchSVHarbor"/>
                    <searchSetting name="Account" refid="searchSVHarborAccount"/>
                </searchSettings>
            </node>
            <node>
                <id>sip</id>
                <label>SIP Check Data</label>
                <icon>businessobject16</icon>
                <chainOfCustody>false</chainOfCustody>
                <contentViewSettings>
                    <contentViewSetting refid="sipCheckDetails"/>
                </contentViewSettings>
                <searchSettings>
                    <searchSetting name="SIP Check Data" refid="searchSipCheck"/>
                </searchSettings>
            </node>
            <node>
                <id>acme</id>
                <label>Acme Retention Records</label>
                <icon>businessobject16</icon>
                <chainOfCustody>false</chainOfCustody>
                <contentViewSettings>
                    <contentViewSetting refid="AcmeRetentionPolicy"/>
                    <contentViewSetting refid="AcmeRecord"/>
                    <contentViewSetting refid="AcmeRetentionEvent"/>
                    <contentViewSetting refid="AcmeHold"/>
                </contentViewSettings>
                <searchSettings>
                    <searchSetting name="Records " refid="srchAcmeRecords"/>
                    <searchSetting name="Retention Policies" refid="srchAcmeRetentionPolicies"/>
                    <searchSetting name="Retention Events" refid="srchAcmeRetentionEvents"/>
                    <searchSetting name="Holds" refid="srchAcmeHolds"/>
                    <searchSetting name="Hold Records" refid="srchAcmeHoldRecords"/>
                </searchSettings>
            </node>
            <node>
                <id>auditlog</id>
                <label>Audit Logs</label>
                <icon>businessobject16</icon>
                <chainOfCustody>false</chainOfCustody>
                <contentViewSettings>
                    <contentViewSetting refid="auditLogDetails"/>
                </contentViewSettings>
                <searchSettings>
                    <searchSetting name="Audit Logs" refid="searchAuditLogs"/>
                </searchSettings>
            </node>
        </node>
    </hierarchy>
    
    <transformationConfigurations>
        
        
        <transformationConfiguration id="AcmeHold">
            <schemaIDs>AcmeHold</schemaIDs>
            <styleURI>dds://DOMAIN=resource/xslt/AcmeHold.xsl</styleURI>
            <pipelineURI>dds://DOMAIN=resource/xproc/displayxqueryresult.xpl</pipelineURI>
            <xquery>expand.xml</xquery>
            <pdf>false</pdf>
        </transformationConfiguration>
        
        <transformationConfiguration id="AcmeHoldRecords">
            <schemaIDs>AcmeHoldRecords</schemaIDs>
            <styleURI>dds://DOMAIN=resource/xslt/AcmeHoldRecords.xsl</styleURI>
            <pipelineURI>dds://DOMAIN=resource/xproc/displayxqueryresult.xpl</pipelineURI>
            <xquery>expand.xml</xquery>
            <pdf>false</pdf>
        </transformationConfiguration>
        
        <transformationConfiguration id="AcmeRetentionEvent">
            <schemaIDs>AcmeRetentionEvent</schemaIDs>
            <styleURI>dds://DOMAIN=resource/xslt/AcmeRetentionEvent.xsl</styleURI>
            <pipelineURI>dds://DOMAIN=resource/xproc/displayxqueryresult.xpl</pipelineURI>
            <xquery>expand.xml</xquery>
            <pdf>false</pdf>
        </transformationConfiguration>
        
        <transformationConfiguration id="AcmeRecord">
            <schemaIDs>AcmeRecord</schemaIDs>
            <styleURI>dds://DOMAIN=resource/xslt/AcmeRecord.xsl</styleURI>
            <pipelineURI>dds://DOMAIN=resource/xproc/displayxqueryresult.xpl</pipelineURI>
            <xquery>expand.xml</xquery>
            <pdf>false</pdf>
        </transformationConfiguration>
        <transformationConfiguration id="AcmeRetentionPolicy">
            <schemaIDs>AcmeRetentionPolicy</schemaIDs>
            <styleURI>dds://DOMAIN=resource/xslt/AcmeRetentionPolicy.xsl</styleURI>
            <pipelineURI>dds://DOMAIN=resource/xproc/displayxqueryresult.xpl</pipelineURI>
            
            <xquery>expand.xml</xquery>
            <pdf>false</pdf>
        </transformationConfiguration>
        
        
        <transformationConfiguration id="displayDefault">
            <schemaIDs/>
            <styleURI>dds://DOMAIN=resource/xslt/xml-verbatim.xsl</styleURI>
            <pipelineURI>dds://DOMAIN=resource/xproc/displayxqueryresult.xpl</pipelineURI>
            <xquery>expand.xml</xquery>
            <pdf>false</pdf>
        </transformationConfiguration>
        <transformationConfiguration id="displayURIDefault">
            <schemaIDs/>
            <styleURI>dds://DOMAIN=resource/xslt/xml-verbatim.xsl</styleURI>
            <pipelineURI>dds://DOMAIN=resource/xproc/display.xpl</pipelineURI>
            <xquery/>
            <pdf>false</pdf>
        </transformationConfiguration>
        <transformationConfiguration id="empty">
            <schemaIDs>empty.xsd</schemaIDs>
            <styleURI>dds://DOMAIN=resource/xslt/empty.xsl</styleURI>
            <pipelineURI>dds://DOMAIN=resource/xproc/display.xpl</pipelineURI>
            <xquery/>
            <pdf>false</pdf>
        </transformationConfiguration>
        <transformationConfiguration id="playerDetails">
            <schemaIDs>playerDetails</schemaIDs>
            <styleURI>dds://DOMAIN=resource/xslt/playerDetails.xsl</styleURI>
            <pipelineURI>dds://DOMAIN=resource/xproc/displayxqueryresult.xpl</pipelineURI>
            <xquery>expand.xml</xquery>
            <pdf>false</pdf>
        </transformationConfiguration>
        <!-- Employee Management -->
        <transformationConfiguration id="employeeDetail">
            <schemaIDs>employeeDetail</schemaIDs>
            <styleURI>dds://DOMAIN=resource/xslt/employeeDetail.xsl</styleURI>
            <pipelineURI>dds://DOMAIN=resource/xproc/displayxqueryresult.xpl</pipelineURI>
            <xquery>expand.xml</xquery>
            <pdf>false</pdf>
        </transformationConfiguration>
        <transformationConfiguration id="employeePayHistoryDetail">
            <schemaIDs>employeePayHistoryDetail</schemaIDs>
            <styleURI>dds://DOMAIN=resource/xslt/employeePayHistoryDetail.xsl</styleURI>
            <pipelineURI>dds://DOMAIN=resource/xproc/displayxqueryresult.xpl</pipelineURI>
            <xquery>expand.xml</xquery>